{
  "v": 1,
  "session": "b3f1c2a0-9d4e-4f2a-8c1b-7e6d5a4b3c2d",
  "agent_role": "fullstack",
  "hook": "PostToolUse",
  "ts": "2026-09-27T14:41:05Z",
  "received_at": "2026-09-27T14:41:05.812Z",
  "tool": "Bash",
  "params_normalized": { "command": "psql [credencial · sha256:9f2c…e41a]" },
  "params_hash": "5f4dcc3b5aa765d61d8327deb882cf99aa1b2c3d4e5f60718293a4b5c6d7e8f9",
  "result": { "exit_code": 1, "duration_ms": 4200 },
  "tokens": 860,
  "cost_usd": 0.0,
  "cwd": "/repo",
  "project": "onixguard",
  "stage": 3,
  "is_error": true,
  "is_repetition": false,
  "credentials": [
    {
      "kind": "conn_string",
      "sha256": "9f2c1a7b3e4d5c6a8b9d0e1f2a3b4c5d6e7f8a9b0c1d2e3f4a5b6c7d8e9f0a1b",
      "label": "[credencial · sha256:9f2c…0a1b]"
    }
  ]
}
